{
  "schema_version": "1.0.0",
  "collection_id": "e7dc1e61-063e-4427-91a7-fd3cc2c500a8",
  "started_at_utc": "2026-08-06T01:26:23Z",
  "completed_at_utc": "2026-08-06T01:26:23Z",
  "profile": "standard",
  "platform": "windows",
  "source_mode": "synthetic",
  "limitations": [
    "Live-response collection is non-destructive and minimally invasive, not perfectly read-only.",
    "This package is not a forensic image and does not include volatile memory.",
    "A valid SHA-256 manifest proves consistency with the recorded manifest, not legal provenance.",
    "The custody ledger is tamper-evident, not tamper-proof.",
    "Heuristic findings require analyst review and are not malware verdicts.",
    "SYNTHETIC DEMONSTRATION DATA — no real endpoint was inspected."
  ]
}
